{
  "schema_version": "1.0",
  "id": "awa",
  "name": "Ancient Warriors",
  "category": "bundled",
  "device": "VBDM",
  "release": "JP: Mar 2021 - Premium Bandai (Included with Ver.Special)",
  "emblem_url": "https://humulos.com/digimon/images/dot/vbdm/emblem_awa.png",
  "digitama": "digitama.gif",
  "stages": [
    "I",
    "II",
    "III",
    "IV",
    "V",
    "VI"
  ],
  "digimon": [
    {
      "id": "chico",
      "name": "Chicomon",
      "name_jp": "Chicomon",
      "name_ko": "치코몬",
      "stage": "I",
      "stage_text": "Stage I (Baby I)",
      "attribute": "Free",
      "activity": "Normal",
      "stats": {
        "dp": "0 (★)",
        "hp": "0",
        "ap": "0"
      },
      "schedule": {
        "awake_hours": "09:00 - 21:00",
        "critical_hit": "Turn NA"
      },
      "sprites": {
        "frame1": "sprites/chico/frame1.gif",
        "frame2": "sprites/chico/frame2.gif"
      },
      "artwork": "sprites/chico/artwork.jpg",
      "lore": {
        "en": "A small, blue-colored, Dragon Digimon child. Although it is small and powerless, it has the potential to evolve to every Dragon Digimon. For that reason, it is a Digimon that is considered exceedingly valuable bytamersandresearchersof Dragon Digimon. It is cherished due to its personality of friendliness and overflowing curiosity, characteristic of Baby Digimon. Just like other Baby Digimon, it spits acidic bubbles to attack, but as usual, their power is nonexistent.Digimon Reference Book⇨ English小さくて青い色をした竜型デジモンの子供。小さくて非力だが、あらゆる竜型デジモンへの進化の可能性を秘めている。そのため、竜型デジモンの研究者やテイマーには非常に貴重がられているデジモンである。幼年期デジモン特有のひとなつこさと好奇心旺盛な性格で可愛がられている。他の幼年期デジモンと同じで、酸性の泡を吐いて攻撃するが相変わらず威力は無い。デジモン図鑑",
        "ko": "작고 푸른색을 띈 용형 디지몬의 아이. 작고 힘이 약하지만 모든 용형 디지몬으로 진화할 수 있는 가능성을 숨기고 있다. 그 때문에 용형 디지몬 연구자나 테이머에게는 매우 귀중한 디지몬이다. 유년기 디지몬 특유의 붙임성이 있고, 호기심이 왕성한 성격으로 귀여움을 받고 있다. 다른 유년기 디지몬과 같이 산성 거품으로 적을 공격하지만 변함없이 큰 위력은 없다."
      },
      "wikimon_url": "https://wikimon.net/Chicomon"
    },
    {
      "id": "chibi",
      "name": "Chibimon",
      "name_jp": "Chibimon",
      "name_ko": "꼬마몬",
      "stage": "II",
      "stage_text": "Stage II (Baby II)",
      "attribute": "Free",
      "activity": "Normal",
      "stats": {
        "dp": "0 (★)",
        "hp": "0",
        "ap": "0"
      },
      "schedule": {
        "awake_hours": "09:00 - 21:00",
        "critical_hit": "Turn NA"
      },
      "sprites": {
        "frame1": "sprites/chibi/frame1.gif",
        "frame2": "sprites/chibi/frame2.gif"
      },
      "artwork": "sprites/chibi/artwork.jpg",
      "lore": {
        "en": "A Baby Dragon Digimon that evolved fromChicomon. It has a torso, hands, and feet—unusual for a Baby Digimon—and so is able to grip objects with both of its small hands, and move while hopping about with both feet. It has a voracious appetite and especially likes sweet foods. Also, as it is very fond of sleeping, it will fall asleep the moment you take your eyes off of it. Its Special Move is ramming into the opponent while hopping about (Hop Attack).Digimon Reference Book⇨ Englishチコモンが進化した幼竜型デジモン。幼年期のデジモンには珍しく、胴体と両手足を持っており、小さな両手で物をつかみ、両足でぴょんぴょん跳ねながら移動することができる。非常に食べ盛りで、特に甘いものが大好き。また寝ることが非常に好きで、目を離すとすぐに寝てしまう。必殺技はぴょんぴょん跳ねながら相手に体当たりをする『ホップアタック』。デジモン図鑑",
        "ko": "치코몬 이 진화한 유룡형 디지몬. 유년기 디지몬들 중에서는 드물게 몸통과 양팔, 양발을 가지고 있어 작은 손으로 물건을 잡고 양발로 깡총깡총 뛰면서 이동할 수 있다. 매우 식욕이 왕성한 시기로 특히 단 것을 아주 좋아하고, 수면 을 취하는 것을 아주 좋아하기 때문에 한눈을 팔면 곧바로 곯아떨어진다. 필살기는 깡총 뛰어서 적에게 몸통박치기를 하는 \"홉 어택\"."
      },
      "wikimon_url": "https://wikimon.net/Chibimon"
    },
    {
      "id": "v",
      "name": "V-mon",
      "name_jp": "V-mon",
      "name_ko": "브이몬",
      "stage": "III",
      "stage_text": "Stage III (Child)",
      "attribute": "Free",
      "activity": "Active",
      "stats": {
        "dp": "10 (★1)",
        "hp": "3",
        "ap": "2"
      },
      "schedule": {
        "awake_hours": "08:00 - 20:00",
        "critical_hit": "Turn 2"
      },
      "sprites": {
        "frame1": "sprites/v/frame1.gif",
        "frame2": "sprites/v/frame2.gif"
      },
      "artwork": "sprites/v/artwork.jpg",
      "lore": {
        "en": "A new species of Digimon that was discovered recently. As a survivor of a species that flourished in theGenesisof the Digital World, it is able to perform \"Armor evolution\", a \"pseudo-evolution\" using theDigimentals. Among others, V-mon is an excellentCombat Species, as it possesses hidden power, and demonstrates tremendous abilities by Armor evolving. Although it has a mischievous, prank-loving personality, it has another side with a strong sense of justice. Its Signature Move is swinging both of its arms in circles, striking the opponent (Bunbun Punch). Its Special Move is knocking down the opponent with an intense headbutt (V-mon Head).Digimon Reference Book⇨ English新たに発見された新種デジモン。デジタルワールドの創世記に繁栄した種族の生き残りで、デジメンタルを用いて“擬似進化”である「アーマー進化」をすることができる。中でもブイモンは優れた戦闘種族であり、秘めた力を持っており、アーマー進化で爆発的な能力を発揮する。性格的にはやんちゃでいたずら好きだが、正義感の強い一面も持っている。得意技は両腕をグルグル振り回し、相手を殴る『ブンブンパンチ』。必殺技は強烈な頭突きで相手を倒す『ブイモンヘッド』。デジモン図鑑",
        "ko": "새롭게 발견된 신종 디지몬. 디지털 월드의 창세기에 번영했던 종족 의 후예로 디지멘탈 을 이용하여 유사 진화인 아머 진화 를 할 수 있다. 그중에서도 브이몬은 뛰어난 전투 종족이며 놀라운 잠재력을 지니고 있어 아머 진화로 폭발적인 힘을 발휘한다. 성격은 응석 부리기 좋아하는 장난꾸러기지만 정의감이 강한 일면도 있다. 특기는 두 팔을 빙빙 휘둘러 상대를 때리는 \"붕붕 펀치\". 필살기는 강렬한 박치기로 상대를 쓰러뜨리는 \"브이몬 헤드\"."
      },
      "wikimon_url": "https://wikimon.net/V-mon"
    },
    {
      "id": "vdra",
      "name": "V-dramon",
      "name_jp": "V-dramon",
      "name_ko": "",
      "stage": "IV",
      "stage_text": "Stage IV (Adult)",
      "attribute": "Vaccine",
      "activity": "Stoic",
      "stats": {
        "dp": "25 (★5)",
        "hp": "5",
        "ap": "3"
      },
      "schedule": {
        "awake_hours": "08:00 - 20:00",
        "critical_hit": "Turn 1"
      },
      "sprites": {
        "frame1": "sprites/vdra/frame1.gif",
        "frame2": "sprites/vdra/frame2.gif"
      },
      "artwork": "sprites/vdra/artwork.jpg",
      "lore": {
        "en": "A mythicalAncient SpeciesDigimon that, even with the vastness of the Digital World, is said to only exist on theFolder Continent. Its existence is extremely rare, and even on the Folder Continent, it is hardly encountered. Also, it is said that only oneDigimon Tamerwas able to tame V-dramon. With the exception of it becoming known as V-dramon due to the \"V\"-shaped pattern on its chest, its way of life is a mystery, but for some reason, it is always mistaken for a dog. While its attack power is exceptional even amongAdults, if put into a predicament, it exhibits power that surpasses even that ofPerfects. Its Special Move is a high-temperature heat ray spewed from its mouth (V Breath Arrow).Digimon Reference Book⇨ English広大なデジタルワールドでも、フォルダ大陸にしか存在しないと言われている、幻の古代種デジモン。その存在は非常に貴重であり、フォルダ大陸でも滅多に出会うことは無い。また、ブイドラモンを手なずける事ができたデジモンテイマーも１人しかいないと言われている。胸にある「Ｖ」型の模様からブイドラモンと呼ばれるようになったこと以外その生態系はナゾであるが、何故か犬に間違えられる。成熟期の中でも並外れた攻撃力の持ち主であるが、窮地に立たされると完全体をも凌ぐパワーを発揮する。必殺技は口から吐き出す高熱の熱線『ブイブレスアロー』。デジモン図鑑",
        "ko": ""
      },
      "wikimon_url": "https://wikimon.net/V-dramon"
    },
    {
      "id": "xv",
      "name": "XV-mon",
      "name_jp": "XV-mon",
      "name_ko": "",
      "stage": "IV",
      "stage_text": "Stage IV (Adult)",
      "attribute": "Free",
      "activity": "Active",
      "stats": {
        "dp": "20 (★4)",
        "hp": "4",
        "ap": "3"
      },
      "schedule": {
        "awake_hours": "08:00 - 20:00",
        "critical_hit": "Turn 2"
      },
      "sprites": {
        "frame1": "sprites/xv/frame1.gif",
        "frame2": "sprites/xv/frame2.gif"
      },
      "artwork": "sprites/xv/artwork.jpg",
      "lore": {
        "en": "An Adult-level Mythical Dragon Digimon that attainedV-mon's natural power and evolved. XV-mon is apurebreedofV-dramon, and it is said that the variant species is V-dramon. The attacks it unleashes using its developed arm and leg strength are tremendous, and are powerful enough to destroy a mountain of rock without leaving a trace. It is feared because it possesses such destructive power, but in reality, it has a strong sense of justice, and will not use that power recklessly. Its Signature Move is a powerful biting technique (Strong Crunch). Its Special Move is an energy wave emitted from the \"X\" pattern on its chest (X-Laser).Digimon Reference Book⇨ Englishブイモンが本来の力を得て進化した成熟期の幻竜型デジモン。エクスブイモンはブイドラモンの原種であり、その派生系の一種がブイドラモンであると言われている。その発達した腕力と脚力から繰り出される攻撃力は凄まじく、山ほどもある岩石など跡形も無く破壊できるほどである。その破壊力を持つために恐れられているが、実際は正義感が強くむやみにその力を使うことは無い。得意技は、強烈な噛み付き技『ストロングクランチ』。必殺技は胸のＸ字の模様から放射されるエネルギー波『エクスレイザー』。デジモン図鑑",
        "ko": ""
      },
      "wikimon_url": "https://wikimon.net/XV-mon"
    },
    {
      "id": "fladra",
      "name": "Fladramon",
      "name_jp": "Fladramon",
      "name_ko": "화염드라몬",
      "stage": "IV",
      "stage_text": "Stage IV (Adult)",
      "attribute": "Free",
      "activity": "Normal",
      "stats": {
        "dp": "20 (★4)",
        "hp": "5",
        "ap": "2"
      },
      "schedule": {
        "awake_hours": "09:00 - 21:00",
        "critical_hit": "Turn 3"
      },
      "sprites": {
        "frame1": "sprites/fladra/frame1.gif",
        "frame2": "sprites/fladra/frame2.gif"
      },
      "artwork": "sprites/fladra/artwork.jpg",
      "lore": {
        "en": "An Armor-level Dragon Man Digimon that evolved through the power of the \"Digimental of Courage\". The \"Digimental of Courage\" has the attribute of \"Flame\", and those that don this Digimental have their combat ability rise like blazing flames, allowing them to perform attacks on enemy Digimon with intense power. Its Signature Move is driving its fiery fists into the enemy (Knuckle Fire). Its Special Move is changing its entire body into a flaming rocket, and pulverizing the enemy (Fire Rocket).Digimon Reference Book⇨ English“勇気のデジメンタル”のパワーによって進化したアーマー体の竜人型デジモン。“勇気のデジメンタル”は“炎”の属性を持っており、このデジメンタルを身に付けたものは燃え上がる炎のように格闘能力が上がり、強烈なパワーで敵のデジモンに攻撃をすることができるようになる。得意技は炎と化した拳を敵にたたきこむ『ナックルファイア』。必殺技は、全身を炎のロケットに変え、敵を粉砕する『ファイアロケット』。デジモン図鑑",